{"alias_members":{"demo":{"member_path":"bin/demo","package_id":"demo.pkg"}},"authority_digest":"0000000000000000000000000000000000000000000000000000000000000010","catalog_sha256":"0000000000000000000000000000000000000000000000000000000000000011","content_ids":["demo.app"],"kind":"package","release_id":"release-0.2.1","schema":"kilix.content.install-authority-binding/v1","source_digest":"0000000000000000000000000000000000000000000000000000000000000012","stable_slot":"demo-slot","version":1}
